{
  "mappingIds": [
    "lape-26-en-general-v0.1",
    "sequential-chromatic-v0.1",
    "frequency-ranked-v0.1",
    "circle-of-fifths-v0.1",
    "random-seed-026-v0.1"
  ],
  "metricVersions": {
    "directional_balance": "directional_balance_v0.1",
    "interval_contour": "interval_contour_v0.1",
    "pitch_span": "pitch_span_v0.1",
    "register_center": "register_center_v0.1",
    "repetition_index": "repetition_index_v0.1"
  },
  "pipelineVersion": "corpus-pipeline-v0.1",
  "provenance": {
    "input_data_sha256": "795ac2bd3e8b3c841c3c83a7ee6612534cc32d3ea486cec67a6bb0b275055996",
    "normalization_committed_blob_sha": "6f1fb75df014d1da43d9412c6c0db0fbb5a3e455",
    "normalization_implementation": "python/lape26/normalize.py",
    "normalization_live_sha256": "9283c3cb1286d1c80d566948422d0ae7a8d6c66ed69b7b52794ba2c9f89d06d5",
    "normalization_profile_id": "lape-text-normalization-v0.1",
    "normalization_spec_path": "specs/text-normalization.md",
    "normalization_status": "provisional-frozen",
    "pipeline_source_commit": "28bfc76aa42fd5c9eda881f9d2665b6e4bb1a526",
    "source_tree_digest": "71f3ff3c879d0e04787fa46ada54776fe41da75bec1e08c160846dc83f6a57aa",
    "working_tree_dirty": false
  },
  "reportId": "baseline-comparison-v0.1",
  "results": {
    "circle-of-fifths-v0.1": {
      "gutenberg_holdout": {
        "itemCount": 200,
        "macro": {
          "directionalBalance": {
            "max": 1.0,
            "mean": 0.026698529608045307,
            "min": -0.9047619047619048
          },
          "pitchSpanSemitones": {
            "max": 25,
            "mean": 18.76,
            "min": 5
          },
          "registerCenterMidi": {
            "max": 66.5,
            "mean": 59.36073855311355,
            "min": 52.57142857142857
          },
          "repetitionIndex": {
            "max": 0.3333333333333333,
            "mean": 0.03706367243867244,
            "min": 0.0
          }
        },
        "micro": {
          "intervalHistogram": {
            "-1": 72,
            "-10": 16,
            "-11": 24,
            "-12": 17,
            "-13": 42,
            "-14": 20,
            "-15": 39,
            "-16": 8,
            "-17": 23,
            "-18": 13,
            "-19": 13,
            "-2": 21,
            "-20": 2,
            "-21": 6,
            "-22": 4,
            "-23": 13,
            "-3": 33,
            "-4": 36,
            "-5": 73,
            "-6": 38,
            "-7": 33,
            "-8": 29,
            "-9": 34,
            "0": 46,
            "1": 35,
            "10": 30,
            "11": 56,
            "12": 22,
            "13": 27,
            "14": 18,
            "15": 32,
            "16": 1,
            "17": 6,
            "18": 10,
            "19": 47,
            "2": 32,
            "20": 3,
            "21": 9,
            "23": 11,
            "24": 1,
            "25": 1,
            "3": 49,
            "4": 23,
            "5": 73,
            "6": 24,
            "7": 26,
            "8": 25,
            "9": 40
          },
          "intervalMovement": {
            "downward": 609,
            "repeated": 46,
            "upward": 601
          }
        }
      },
      "gutenberg_validation": {
        "itemCount": 200,
        "macro": {
          "directionalBalance": {
            "max": 1.0,
            "mean": 0.005229017486584034,
            "min": -1.0
          },
          "pitchSpanSemitones": {
            "max": 25,
            "mean": 18.915,
            "min": 3
          },
          "registerCenterMidi": {
            "max": 67.5,
            "mean": 59.710788822288826,
            "min": 49.75
          },
          "repetitionIndex": {
            "max": 0.3333333333333333,
            "mean": 0.026757936507936505,
            "min": 0.0
          }
        },
        "micro": {
          "intervalHistogram": {
            "-1": 71,
            "-10": 27,
            "-11": 19,
            "-12": 19,
            "-13": 46,
            "-14": 14,
            "-15": 28,
            "-16": 18,
            "-17": 24,
            "-18": 16,
            "-19": 35,
            "-2": 52,
            "-20": 1,
            "-21": 8,
            "-22": 3,
            "-23": 6,
            "-25": 1,
            "-3": 22,
            "-4": 45,
            "-5": 73,
            "-6": 23,
            "-7": 20,
            "-8": 20,
            "-9": 36,
            "0": 32,
            "1": 25,
            "10": 20,
            "11": 53,
            "12": 26,
            "13": 24,
            "14": 23,
            "15": 24,
            "16": 3,
            "17": 17,
            "18": 11,
            "19": 55,
            "2": 44,
            "20": 1,
            "21": 4,
            "23": 10,
            "24": 1,
            "3": 39,
            "4": 19,
            "5": 75,
            "6": 42,
            "7": 24,
            "8": 23,
            "9": 41
          },
          "intervalMovement": {
            "downward": 627,
            "repeated": 32,
            "upward": 604
          }
        }
      },
      "long_negative": {
        "itemCount": 12,
        "macro": {
          "directionalBalance": {
            "max": 0.3157894736842105,
            "mean": 0.01566999900008574,
            "min": -0.24444444444444444
          },
          "pitchSpanSemitones": {
            "max": 24,
            "mean": 20.083333333333332,
            "min": 15
          },
          "registerCenterMidi": {
            "max": 65.0,
            "mean": 60.90858585858586,
            "min": 57.4
          },
          "repetitionIndex": {
            "max": 0.125,
            "mean": 0.04391835016835017,
            "min": 0.0
          }
        },
        "micro": {
          "intervalHistogram": {
            "-1": 5,
            "-10": 3,
            "-13": 4,
            "-14": 2,
            "-15": 6,
            "-19": 4,
            "-2": 4,
            "-3": 1,
            "-4": 2,
            "-5": 5,
            "-6": 4,
            "-7": 2,
            "-8": 1,
            "-9": 8,
            "0": 5,
            "1": 5,
            "10": 5,
            "11": 3,
            "13": 1,
            "14": 6,
            "15": 1,
            "19": 4,
            "2": 3,
            "3": 2,
            "4": 2,
            "5": 7,
            "6": 4,
            "7": 3,
            "8": 2,
            "9": 7
          },
          "intervalMovement": {
            "downward": 51,
            "repeated": 5,
            "upward": 55
          }
        }
      },
      "long_neutral": {
        "itemCount": 12,
        "macro": {
          "directionalBalance": {
            "max": 0.17142857142857143,
            "mean": -0.023965192175976636,
            "min": -0.21428571428571427
          },
          "pitchSpanSemitones": {
            "max": 24,
            "mean": 21.083333333333332,
            "min": 14
          },
          "registerCenterMidi": {
            "max": 61.72727272727273,
            "mean": 59.25513468013468,
            "min": 57.0
          },
          "repetitionIndex": {
            "max": 0.125,
            "mean": 0.045075757575757575,
            "min": 0.0
          }
        },
        "micro": {
          "intervalHistogram": {
            "-1": 5,
            "-10": 1,
            "-11": 1,
            "-12": 2,
            "-13": 2,
            "-14": 3,
            "-15": 2,
            "-16": 2,
            "-17": 1,
            "-19": 2,
            "-2": 4,
            "-22": 1,
            "-23": 2,
            "-3": 2,
            "-4": 4,
            "-5": 7,
            "-6": 3,
            "-7": 2,
            "-8": 4,
            "-9": 7,
            "0": 5,
            "1": 4,
            "10": 1,
            "11": 1,
            "12": 2,
            "13": 3,
            "14": 2,
            "15": 3,
            "17": 3,
            "18": 1,
            "19": 5,
            "2": 7,
            "21": 1,
            "22": 1,
            "23": 1,
            "3": 2,
            "4": 2,
            "5": 6,
            "7": 2,
            "9": 1
          },
          "intervalMovement": {
            "downward": 57,
            "repeated": 5,
            "upward": 48
          }
        }
      },
      "long_positive": {
        "itemCount": 12,
        "macro": {
          "directionalBalance": {
            "max": 0.3150684931506849,
            "mean": 0.11027764934862937,
            "min": -0.08888888888888889
          },
          "pitchSpanSemitones": {
            "max": 24,
            "mean": 21.583333333333332,
            "min": 17
          },
          "registerCenterMidi": {
            "max": 61.833333333333336,
            "mean": 58.99684343434344,
            "min": 55.916666666666664
          },
          "repetitionIndex": {
            "max": 0.1111111111111111,
            "mean": 0.037037037037037035,
            "min": 0.0
          }
        },
        "micro": {
          "intervalHistogram": {
            "-1": 5,
            "-10": 5,
            "-11": 2,
            "-12": 1,
            "-13": 6,
            "-15": 3,
            "-17": 4,
            "-2": 6,
            "-21": 1,
            "-23": 2,
            "-3": 1,
            "-4": 3,
            "-5": 4,
            "-6": 4,
            "-7": 1,
            "-8": 1,
            "-9": 2,
            "0": 4,
            "1": 2,
            "10": 2,
            "11": 7,
            "12": 4,
            "13": 3,
            "14": 1,
            "15": 5,
            "18": 1,
            "19": 6,
            "2": 4,
            "22": 1,
            "3": 4,
            "5": 3,
            "6": 6,
            "7": 2,
            "8": 1,
            "9": 4
          },
          "intervalMovement": {
            "downward": 51,
            "repeated": 4,
            "upward": 56
          }
        }
      },
      "medium_negative": {
        "itemCount": 12,